Distribution South,The Warehouse Sylvia Park,Noel Leeming Penrose Clearance,Distribution South
Distribution North,The Warehouse Royal Oak,Noel Leeming Royal Oak,Distribution North
Distribution South,Noel Leeming Manukau Westfield,The Warehouse Pakuranga,Noel Leeming Botany,Distribution South
Distribution North,The Warehouse St Lukes,Noel Leeming St Lukes Mega,Distribution North
Distribution South,The Warehouse Manukau,Distribution South
Distribution North,The Warehouse Westgate,Noel Leeming Henderson,Distribution North
Distribution North,The Warehouse Glenfield Mall,Noel Leeming Albany,Distribution North
Distribution North,Noel Leeming Wairau Park,Noel Leeming Glenfield Clearance,The Warehouse Albany,The Warehouse Milford,Distribution North
Distribution North,Noel Leeming St Lukes Westfield,Noel Leeming New Lynn,The Warehouse Mt Roskill,Distribution North
Distribution North,The Warehouse New Lynn,The Warehouse WestCity,Distribution North
Distribution North,The Warehouse Lunn Avenue,Noel Leeming Lunn Avenue,Noel Leeming Queen Street,Distribution North
Distribution North,The Warehouse Newmarket,Noel Leeming Newmarket,Distribution North
Distribution North,The Warehouse Atrium,Distribution North
Distribution South,Noel Leeming Manukau Supa Centre,Noel Leeming Ormiston,The Warehouse Botany Downs,Distribution South
Distribution South,The Warehouse Takanini,Noel Leeming Papakura,The Warehouse Clendon,Distribution South
Distribution North,The Warehouse Lincoln Road,Noel Leeming Massey,Distribution North
Distribution South,Noel Leeming Papatoetoe,The Warehouse Airport,Noel Leeming Sylvia Park,Distribution South
